CENTRE-VAL DE LOIRE;EURE ET LOIR;;01/02/2003;2828001;Musée du Château Saint-Jean;Rue du Château;28400;NOGENT-LE-ROTROU;0237521802;0237291204;www.ville-nogent-le-rotrou.fr/html/art_cult/musee/collec.htm;1er janvier, 1er mai, 1er novembre,  25 décembre;Ouvert du mercredi au lundi de 10h à 12h et de 14h à 18h de mai à octobre et de novembre à avril de 10h à 12h et de 14h à 17h;
CENTRE-VAL DE LOIRE;EURE ET LOIR;;01/02/2003;2836301;Musée Farcot;2, Place Farcot;28700;SAINVILLE;0237246006;0237246315;mairie.perso.fr/sainville/index.htm;;;
CENTRE-VAL DE LOIRE;INDRE;;01/02/2003;3600601;Musée de la Chemiserie et de l'Elégance Masculine;Rue Charles Brillaud;36200;ARGENTON-SUR-CREUSE;0254243469;0254244192;http://chemiserie.cc-argenton.fr;24 au 31 décembre, Janvier, du 1er au 14 février;Ouvert du 15 février au 30 juin et du 1er septembre au 23 décembre du mardi au dimanche de 9h30 à 12h et de 14h à 18h, juillet-août lundi de 14h à 18h30  et du mardi au dimanche de 10h à 12h30 et de 14h à 18h30;
CENTRE-VAL DE LOIRE;INDRE;;01/02/2003;3601001;Château Musée;31/33 Rue Hersent Luzarche;36290;AZAY-LE-FERRON;0254392006;0254392006;www.château-azay-le-ferron.com;Fermé du 12 novembre au 29 mars;Ouvert du 30 au 31 mars, d'avril à juin, septembre tous les jours de 10h à 12h et de 14h à 18h, en juillet-août tous les jours de 10h à 18h30, d'octobre au 11 novembre de 10h à 12h et de 14h à 17h30;
CENTRE-VAL DE LOIRE;INDRE;;01/02/2003;3604401;Musées de Châteauroux - Hôtel Bertrand;2, Rue Descente-des-Cordeliers;36000;CHATEAUROUX;0254611230;0254611231;www.chateauroux-metropole.fr - Site de la ville;Janvier et jours fériés sauf 14 juillet, 15 août et 1er novembre. D'octobre à décembre pour le couvent des cordeliers et sur rdv toute l'année pour la maison des ATP;"Ouvert du mardi au dimanche d'octobre à mai de 14h à 18h et de juin à septembre de 10h à 12h et de 14h à 18h, le week-end de 10h à 12h30 et de 14h à 18h.
Le Couvent des Cordeliers est ouvert lors des manifestations ou expositions et la maison des ATP sur";
CENTRE-VAL DE LOIRE;INDRE;;02/05/2002;3608801;Musée de l'Hospice Saint-Roch;"23, Rue de l'Hospice Saint-Roch
B.P. 150";36100;ISSOUDUN Cedex;0254210176;0254218856;www.issoudun.fr;1er mai, 1 & 11 novembre, 24 au 26 décembre 31 décembre au 31 Janvier;"Ouvert du 1er octobre au 30 décembre et du 1er février au 30 avril du mercredi à dimanche de 10h à 12h et de 14h à 18h, 
 du 2 mai au 30 juin et septembre lundi et mardi de 14h à 18h et mercredi à dimanche de 10h à 12h et de 14h à 18h, en juillet-août lu";
CENTRE-VAL DE LOIRE;INDRE;;01/02/2003;3604601;Musée George Sand et de la Vallée Noire;71, Rue Venôse;36400;LA CHATRE;0254483679;0254483679;Site de la région ou www.pays-george-sand.com;Janvier, 1er mai, 25 et 26 décembre;Ouvert du mercredi au lundi en février, mars, novembre, décembre de 14h à 17h, avril, octobre de 14h30 à 18h30, mai, juin, septembre de 10h à 12h et de 14h à 18h30, le dimanche de 14h à 18h30, et en juillet-août tous les jours de 10h à 12h et de 14h à 18h;
CENTRE-VAL DE LOIRE;INDRE;;01/02/2003;3609201;Musée de Géologie Régionale;;36600;LANGE;0254000442;0254408009;;;;
CENTRE-VAL DE LOIRE;INDRE;;01/02/2003;3601801;Musée Ornithologique (Ecomusée de la Brenne);Château Naillac;36300;LE BLANC;0254372520;0254286949;Site de la région centre;Janvier, 11 novembre et 25 décembre;Ouvert du 26 mars au 30 juin et septembre du mardi au dimanche de 14h à 18h, juillet-août tous les jours de 10h à 12h30 et de 14h à 18h, du 1er octobre au 31 décembre du mardi au dimanche de 14h à 17h30;
CENTRE-VAL DE LOIRE;INDRE;;01/02/2003;3620001;Musée Archéologique d'Argentomagus;"""Les Mersans""
B.P. 6";36200;SAINT-MARCEL;0254244731;0254241170;www.argentomagus.com ou www.argentomagus.cc-argenton.fr;du 24 décembre au 1er janvier inclus et durant les trois premières semaines de janvier;Ouvert du 1er septembre au 30 juin du mercredi au lundi de 9h30-12h et de 14h-18h et en juillet-août tous les jours;
CENTRE-VAL DE LOIRE;INDRE ET LOIRE;;01/02/2003;3700302;Musée de la poste;6, Rue Joyeuse;37400;AMBOISE;0147570011;;;;;
CENTRE-VAL DE LOIRE;INDRE ET LOIRE;;01/02/2003;3700301;Musée Hôtel Morin;"60, Rue Concorde
B.P. 247";37402;AMBOISE Cedex;0247234742;0247231980;Site de la ville www.ville-amboise.fr;1er octobre au 30 juin excepté du 14 au 22 novembre;Ouvert du mercredi au lundi de 10h à 12h30 et de 14h à 18h du 15 juin aux journées du patrimoine. Le reste de l'année ouvert pour les groupes sur demande;
CENTRE-VAL DE LOIRE;INDRE ET LOIRE;;01/02/2003;3707201;Le Carroi, Musée d’Arts et d’Histoire;44, Rue Haute-Saint-Maurice;37500;CHINON;0247931812;0247934090;www.cc-cvl.fr;;Ouvert du mercredi au lundi du 30 avril  au 18 septembre de 14h30 à 18h30, et du 19 septembre au 13 novembre du vendredi au dimanche de 14h à 18h;
CENTRE-VAL DE LOIRE;INDRE ET LOIRE;;01/02/2003;3711501;"""Maison Musée"" René Descartes";29, Rue Descartes;37160;DESCARTES;0247597919;0247597220;www.ville-descartes.fr/pratique/f_pratique.htm;1er mai, 1er novembre;Ouvert de 14h à 18h du mercredi au lundi d'avril à mai et de septembre à octobre, de 10h à 12h et de 14h à 18h de juin à septembre;
CENTRE-VAL DE LOIRE;INDRE ET LOIRE;;30/04/2002;3711301;Musée de Préhistoire du Grand Pressigny;Château du Grand-Pressigny;37350;LE GRAND PRESSIGNY;0247949020;0247949960;www.prehistoiregrandpressigny.fr;1er janvier, 25 décembre;Ouvert du mercredi au lundi d'octobre à mars de 10h à 12h30 et de 14h à 17h et le dimanche et jours fériés de 10h à 17h et d'avril à fin juin et septembre tous les jours de 10h à 18h et en juillet-août tous les jours de 10h à 19h;
CENTRE-VAL DE LOIRE;INDRE ET LOIRE;;01/02/2003;3713202;Musée du Terroir;;37600;LOCHES;;;;;;
CENTRE-VAL DE LOIRE;INDRE ET LOIRE;;01/02/2003;3713201;Musée Lansyer;1, rue Lansyer;37600;LOCHES;0247594821;0247590545;Site de la région centre ou http://www.lochesentouraine.com;1er novembre au 31 mars;Ouvert du 4 juin au 2 novembre, de juin à août tous les jours, de septembre à novembre du mercredi au dimanche de 10h à 18h30;
CENTRE-VAL DE LOIRE;INDRE ET LOIRE;;01/02/2003;3719601;Musée de l'Hôtel de Ville;1, Place du Marché;37120;RICHELIEU;0247581013;0247581642;www.ville-richelieu.fr;1er janvier, 25 décembre;Ouvert du 2 janvier au 1er avril 2015 et du 12 novembre au 31 décembre du lundi au vendredi de 10h à12h et de 14h à 17h, et du 2 avril au 30 septembre le lundi et du mercredi au vendredi de 10h à 12h et de 14h à 18h;
CENTRE-VAL DE LOIRE;INDRE ET LOIRE;;30/04/2002;3720501;Musée Balzac;Château de Saché;37190;SACHE;0247268650;0247268028;www.musee-balzac.fr;1er janvier, 25 décembre;Ouvert d'octobre à mars de 10h à 12h30 et de 14h à 17h, d'avril à juin et septembre de 10h à 18h et en juillet-août de 10h à 19h;
CENTRE-VAL DE LOIRE;INDRE ET LOIRE;;01/02/2003;3722601;Musée Municipal;Place du Château;37800;SAINTE-MAURE-DE-TOURAINE;0247656620;0247340428;www.sainte-maure-de-touraine.fr;Musée fermé provisoirement;Ouvert en 2014 pour JEP et deux expositons;
CENTRE-VAL DE LOIRE;INDRE ET LOIRE;;01/02/2003;3724101;Musée du Savignéen;10, Rue Fbg de la Rue;37340;SAVIGNE-SUR-LATHAN;0247249514;;www.museedusavigneen.com;Janvier et février;Ouvert de mi-mars à mi-juin et de mi-septembre à mi-novembre les samedis, dimanches et jours fériés de 14h30 à 18h, de juillet à mi-septembre du mercredi au lundi de 14h30 à 18h;
CENTRE-VAL DE LOIRE;INDRE ET LOIRE;;18/07/2002;3724201;Ecomusée du Véron;80, Route de Candes;37420;SAVIGNY-EN-VERON;0247580905;0247580615;www.ecomusee-veron.fr;1er mai, 1er novembre, du 23 décembre au 8 janvier. De la fin des vacances de la Toussaint jusqu'au début des vacances de Pâques pour les individuels;Ouvert du 15 avril au 31 mai et du 1er octobre au 5 novembre de 10h à 12h30 et de 14h à 18h en semaine et de 14h à 18h les week-ends et jours fériés. Du 1er juin au 30 septembre de 10h à 12h30 et de 14h à 18h, ouverture jusquà 19h les week-ends et jours f;
CENTRE-VAL DE LOIRE;INDRE ET LOIRE;;30/04/2002;3724801;Musée François Rabelais;Maison de la Devinière;37500;SEUILLY;0247959118;0247958937;www.musee-rabelais.fr ou site du conseil général;25 décembre et 1er janvier;Ouvert tous les jours en juillet-août de 10h à 19h, d'octobre à mars du mercredi au dimanche de 10h à 12h30 et de 14h à 17h, d'avril à juin et septembre du mercredi au lundi de 10h à 12h30 et de 14h à 18h;
CENTRE-VAL DE LOIRE;INDRE ET LOIRE;;01/02/2003;3726101;Muséum d'Histoire Naturelle;3, Rue du Président Merville;37000;TOURS;0247641331;;www.museum.tours.fr;1er janvier, 1er mai, 14 juillet, 1er et 11 novembre, 25 décembre;Ouvert du mardi au vendredi de 10h à 12h et de 14h à 18h, samedi, dimanche de 14h à 18h, le lundi est réservé aux scolaires;
CENTRE-VAL DE LOIRE;INDRE ET LOIRE;;01/02/2003;3726105;Musée du Compagnonnage;"Cloître Saint-Julien
8, Rue Nationale";37000;TOURS;0247216220;0247216890;www.museecompagnonnage.fr;1er janvier, 1er mai, 14 juillet, 1er et 11 novembre, 25 décembre;Ouvert du 2 janvier au 15 juin du mercredi au lundi de 9h à 12h30 et de 14h à 18h, du 16 juin au 15 septembre tous les jours de 9h à 12h30 et de 14h à 18h et du 16 septembre au 31 décembre du mercredi au lundi de 9h à 12h30 et de 14h à 18h;
CENTRE-VAL DE LOIRE;INDRE ET LOIRE;;01/02/2003;3726104;Musée des Vins de Touraine;"Cellier Saint-Julien
16, Rue Nationale";37000;TOURS;0247610793;0247216890;site de la ville;;;
CENTRE-VAL DE LOIRE;INDRE ET LOIRE;;06/01/2002;3726102;Musée des Beaux-Arts;18, Place François Sicard;37000;TOURS;0247056873;0247053891;www.mba.tours.fr ou www.musees-regioncentre.fr;1er janvier, 1er mai, 14 juillet, 1er et 11 novembre, 25 décembre;Ouvert du mercredi au lundi de 9h à 12h45 et de 14h à 18h, et de 9h à 18h pendant les expositions temporaires;
CENTRE-VAL DE LOIRE;INDRE ET LOIRE;;01/02/2003;3726103;Musée de l'Hôtel Goüin;"25, Rue du Commerce
B.P. 1105";37011;TOURS Cedex;0247662232;0247663294;Site du conseil général;;;
CENTRE-VAL DE LOIRE;INDRE ET LOIRE;;01/02/2003;3728201;Musée de Minerve;Place du Musée;37290;YZEURES-SUR-CREUSE;0247942654;0247944332;;;Ouvert d'avril à octobre de 8h à 18h tous les jours;
CENTRE-VAL DE LOIRE;LOIR ET CHER;;01/02/2003;4101804;Maison de la Magie;1, Place du Château;41000;BLOIS;0254552626;0254852628;www.maisondelamagie.fr;17 avril, 1er et 8 mai, 5 juin;Ouvert  du 7 avril au 23 septembre et du 27 octobre au 11 novembre 2012 tous les jours de 10h à 12h30 et de 14h à 18h30;
CENTRE-VAL DE LOIRE;LOIR ET CHER;;01/02/2003;4101805;Muséum d'Histoire Naturelle;"""Les Jacobins"" 
Rue Anne de Bretagne";41000;BLOIS;0254742100;0254902101;www.ville-blois.fr;1er janvier, 1er mai, 1er novembre, 25 décembre;Ouvert du mercredi et samedi de 10h à 12h et de 14h à 18h, le dimanche de 14h à 18h et pendant les vacances scolaires (toutes zones) du mardi au samedi de 10h à 12h et de 14h à 18h, et le dimanche de 14h à 18h.;
CENTRE-VAL DE LOIRE;LOIR ET CHER;;01/02/2003;4101801;Château Musées de Blois;Château de Blois;41000;BLOIS;0254903333;0254903330;www.chateaudeblois.fr;1er janvier et 25 décembre;Ouvert tous les jours de janvier à mars de 9h à 12h30 et de 13h30 à 17h30. Du 1er avril au 30 juin et en septembre de 9h à 18h30, du 1er juillet à août de 9h à 19h, et octobre de 9h à 18h.;
CENTRE-VAL DE LOIRE;LOIR ET CHER;;01/02/2003;4113601;Musée de la Corbillière;Château de la Corbillière;41500;MER;0254817021;0254817021;;;Ouvert de janvier à mars et d'octobre à novembre de 14h30 à 18h, mercredi, samedi, et d'avril à septembre de 14h30 à 19h du mercredi au dimanche et jours fériés;
CENTRE-VAL DE LOIRE;LOIR ET CHER;;01/02/2003;4115801;Atelier Musée Louis Leygue;106, Rue des Venages;41100;NAVEIL;0254772613;0254894358;;;Ouvert quatre après-midi dans l'année (2 en juillet et  2 en août). Permanence assurée par le personnel du musée Vendôme;
CENTRE-VAL DE LOIRE;LOIR ET CHER;;01/02/2003;4119401;Musée de Sologne;"Moulin du Chapitre
B.P. 147";41206;ROMORANTIN-LANTHENAY Cedex;0254953366;0254953360;www.museedesologne.com;Les 1er janvier, 1er mai, 25 décembre;Ouvert du 2 janvier au 31 décembre de 10h à 12h et de 14h à 18h dimanche et jours fériés de 14h à 18h;
CENTRE-VAL DE LOIRE;LOIR ET CHER;;01/02/2003;4125801;Musée Archéologique;Hôtel de Ville;41140;THESEE;0254714020;0254713728;www.musees.regioncentre;;Visites guidées à 11h15 et à 16h, tous les week-end et jours fériés de Pâques au 30 septembre;
CENTRE-VAL DE LOIRE;LOIR ET CHER;;01/02/2003;4126901;Musée de Vendôme;Cloître de la Trinité;41100;VENDOME;0254772613;0254894358;www.vendome.eu/intro/1p1e-421-musee-vendome.html-vendome.html ou www.musees.regioncentre.fr;1er janvier, le 1er mai, le 25 décembre;Ouvert du 1er avril au 31 octobre du mercredi au lundi de 10h à 12h et de 14h à 18h et du 1er novembre au 31 mars le lundi et du mercredi au samedi de 10h à 12h et de 13h30 à 17h30;
CENTRE-VAL DE LOIRE;LOIRET;;01/02/2003;4500802;Musée Municipal Théâtre Forain et Archéologique;Quartier du Paradis;45410;ARTENAY;0238800973;0238804803;www.musee-theatre-forain.fr;;Ouvert du 1er juillet au 31 août de 10h à 12h et de 14h à 18h - et du 1er juin au 30 septembre de 14h à 17h.;
CENTRE-VAL DE LOIRE;LOIRET;;01/02/2003;4502801;Musée Daniel Vannier;"Hôtel de Ville - Service patrimoine
20, Rue du Change";45190;BEAUGENCY;0238446264;0238464037;site de la région ou www.patrimoine-beaugency.fr;;;
CENTRE-VAL DE LOIRE;LOIRET;;01/02/2003;4508201;Musée de la Marine de Loire;"Ecuries du Château
1, Place Aristide Briand";45110;CHATEAUNEUF-SUR-LOIRE;0238468446;0238464101;www.chateauneuf-sur-loire.com ou www.musees-centre.com;1er janvier, 1er mai, 25 décembre;Ouvert du mercredi au lundi du 1er avril au 31 octobre de 10h à 18h et du 1er novembre au 31 mars de 14h à 18h;°
CENTRE-VAL DE LOIRE;LOIRET;;01/02/2003;4508501;Musée d'Art et d'Archéologie;2, Faubourg Puyrault;45230;CHATILLON-COLIGNY;0238926406;0238960944;http://www.ifrance.com/chatillon-coligny;;Ouvert de 14h à 18h  du 1er avril au 30 juin le vendredi, samedi, dimanche, du 1er juillet au 31 août le jeudi, vendredi, samedi, dimanche, lundi et du 1er septembre au 15 novembre le vendredi, samedi, dimanche;
CENTRE-VAL DE LOIRE;LOIRET;;01/02/2003;4515501;Château-Musée de Gien : chasse, histoire et nature en Val de Loire;"Château de Gien
B.P. 99";45503;GIEN Cedex;0238676969;0238380732;www.château-gien.com;25 décembre et en janvier;Ouvert du 1er février au 31 mars et du 1er octobre au 31 décembre de 14h à 17h et du 1er avril au 30 juin et du 1er au 30 septembre de 13h30 à 18h, en juillet/août tous les jours de 13h30 à 18h;
CENTRE-VAL DE LOIRE;LOIRET;;01/02/2003;4520301;Musée Gaston Couté;"Espace culturel La Monnaye
22 Rue des Remparts";45130;MEUNG-SUR-LOIRE;0238225336;0238440302;www.meung-sur-loire.com;Fermé pendant les vacances scolaires de Noël, 3 semaines en août, 1er mai et 1er novembre;Ouvert le mercredi et vendredi de 14h30 à 18h30, le samedi de 9h30 à 12h30, le dimanche de 15h à 18h;
CENTRE-VAL DE LOIRE;LOIRET;;27/12/2002;4520801;Musée du Gatinais;7, Rue du Château;45200;MONTARGIS;0238934563;;;;Ouvert samedi et dimanche de 13h30 à 17h30 depuis le 16 janvier 2008, depuis le 15 avril 2009 ouvert le mercredi et samedi de 13h30 à 17h30;
CENTRE-VAL DE LOIRE;LOIRET;;27/12/2002;4520802;Musée Girodet;2, rue de la Chaussée;45200;MONTARGIS;0238980781;0238935919;www.montargis.fr/musee.htm;Jours fériés;Ouvert du mercredi au dimanche 9h à 12h et de 13h30 à 17h30 (vendredi 17h);
CENTRE-VAL DE LOIRE;LOIRET;;06/01/2002;4523403;Musée des Beaux-Arts;1, rue Fernand Rabier;45000;ORLEANS;0238792155;0238792008;Région : www.musees.regioncentre.fr ou  www.orleans.fr (rubrique culture/musee);1er et 11 novembre, 25 décembre;Ouvert de 10h à 18h du mardi au dimanche;
CENTRE-VAL DE LOIRE;LOIRET;;01/02/2003;4523402;Hôtel Cabu, Musée d'Histoire et d'Archéologie;"Square Abbé Desnoyers
Hôtel Cabu";45000;ORLEANS;0238792560;0238792008;Site de la ville;1er et 11 novembre, 25 décembre;"Salles gallo-romaine et Jeanne d'Arc : Du mardi au vendredi : 9h30-12h (groupes sur réservation) et 13h30 - 17h45
Toutes les salles :
Samedi : 9h30 - 12h et 13h30 - 17h45
Dimanche : 14h - 18h";
CENTRE-VAL DE LOIRE;LOIRET;;06/01/2002;4523401;Muséum d'Orléans pour la biodiversité et l'environnement;6, Rue Marcel Proust;45000;ORLEANS;0238546105;0238531967;www.orleans.fr;1er janvier, 8 mai, 1er et 11 novembre, 25 décembre;Ouvert tous les jours de 14h à 18h;
CENTRE-VAL DE LOIRE;LOIRET;;01/02/2003;4525201;Musée Municipal;"Direction de l'action culturelle
5, Place Denis Poisson - B.P. 706";45307;PITHIVIERS Cedex;0238300064;0238300064;;;;
CORSE;CORSE DU SUD;;01/02/2003;2A00403;Musée Fesch;50-52, rue du Cardinal Fesch;20000;AJACCIO;0495262626;0495218094;www.musee-fesch.com;;Ouvert le lundi, mercredi, samedi de 10h à 17h et le jeudi vendredi et dimanche du 3eme week end du mois de 12h à 17h du 1er octobre  au 30 avril, et le lundi mercredi, samedi de 10h30 à 18h et le jeudi, vendredi et dimanche de 12h00 à 18h du 1er mai au 3;Jusqu'à 20h30 le vendredi en juillet-août
CORSE;CORSE DU SUD;;06/01/2002;2A00402;Musée de la Maison Bonaparte;Rue Saint-Charles;20000;AJACCIO;0495214389;0495216132;www.musee-maisonbonaparte.fr - www.musees-nationaux-napoleoniens.org;25 janvier 1er janvier;Ouvert du 1er octobre au 31 mars de 10h30 à 12h30 et de 13h15 à 16h30, du 1er avril au 30 septembre de 10h30 à 12h30 et de 13h15 à 18h;
CORSE;CORSE DU SUD;;01/02/2003;2A00401;Musée Napoléonien;"Hotel de Ville
Avenue Antoine Serafini";20000;AJACCIO;0495515253;0495218094;http://www.napoleon.org ou http://www.ajaccio.fr/;;Ouvert du 15 juin au 15 septembre du lundi au vendredi de 9h à 11h45 et de 14h à 17h45 et du 16 septembre au 14 juin du lundi au vendredi de 9h à 11h45 et de 14h à  16h45;
CORSE;CORSE DU SUD;;01/02/2003;2A14201;Musée de l'Alta Rocca;"Quartier Prato
Avenue Lieutenant Aviateur de Peretti";20170;LEVIE;0495780078;0495784160;http://www.levie-altarocca.com;1er janvier, 1er mai, 14 juillet, 15 août, 25 décembre;Ouvert du mardi au samedi d'octobre à mai de 10h à 17h et de juin à septembre tous les jours de 10h à 18h;
CORSE;CORSE DU SUD;;01/02/2003;2A27201;Musée de Préhistoire Corse;Boulevard Jacques Nicolai;20100;SARTENE;0495770109;0495770109;www.cg-corsedusud.fr;Jours fériés;Ouvert tous les jours de juin à septembre de 10h à 18h et du lundi au vendredi d'octobre à mai de 10h à 17h;
CORSE;HAUTE-CORSE;;01/02/2003;2B00901;Musée Départemental d'Archéologie d'Aléria;Fort de Matra;20270;ALERIA;0495570092;0495555700;www.isula.corsica;1er janvier, 1er mai, 1er et 11 novembre, 25 décembre;Ouvert du 16 mai au 30 septembre de 9h à 12h et de 13h à 18h et du 1er octobre au 15 mai de 8h à 12h et de 13h à 17h;
CORSE;HAUTE-CORSE;;01/02/2003;2B03301;Musée de Bastia;"Place du donjon
La Citadelle";20200;BASTIA Cedex;0495310912;0428270099;www.musee-bastia.com;1er et 11 novembre, 1er et 8 mai, et pendant les vacances scolaires de Noël;Ouvert du 1er mai au 30 septembre de 10h à 18h30, tous les jours en juillet août, du 1er octobre au 30 avril de 9h à 12h et de 14h à17h (basse saison);
CORSE;HAUTE-CORSE;;01/02/2003;2B09601;Musée de la Corse;"La Citadelle
B.P. 73";20250;CORTE;0495452545;0495452536;www.musee-corse.com;1er mai, 24 décembre, autres jours fériés, 31 décembre au 14 janvier inclus;Ouvert du 1er novembre au 31 mars de 10h à 17h du lundi au samedi, du 1er avril au 21 juin de 10h à 18h du mardi au dimanche, du 22 juin au 20 septembre de 10h à 20h tous les jours, du 22 septembre au 31 octobre de 10h à 18h du mardi au dimanche;Du 22 juin au 21 septembre jusqu'à 20h (tous les jours)
CORSE;HAUTE-CORSE;;05/07/2012;2B14801;Musée Archéologique de Mariana - Prince Rainier III de Monaco;Mairie de Lucciana;20290;LUCCIANA;;;http://www.musee-mariana.com/;;;
CORSE;HAUTE-CORSE;;01/02/2003;2B16901;Musée Départemental Pascal Paoli;Hameau de la Stretta 20261;20218;MOROSAGLIA;0495610497;0495463137;www.cg2b.fr;1er janvier, 1er mai, 1er et 11 novembre et 25 décembre;Ouvert du 16 mai au 30 septembre de 9h à 12h et de 13 à 18h et du 1er octobre au 15 mai de 8h à 12h et de 13h à 17h;
GRAND EST;ARDENNES;;01/02/2003;0805301;Musée de la Maison de la Dernière Cartouche;12 Avenue de la Dernière Cartouche;08140;BAZEILLES;0324271586;;www.maisondeladernierecartouche.com;15 décembre au 5 janvier;Ouvert du mercredi au dimanche du 1er avril au 30 septembre de 13h30 à 18h et du 1er octobre au 31 mars de 13h30 à 17h;
GRAND EST;ARDENNES;;01/02/2003;0810503;Musée de l'Ardenne;31, Place Ducale;08000;CHARLEVILLE-MEZIERES;0324324464;0324324469;www.mairie-charlevillemezieres.fr/htm/culture/rimbaud.htm;;Ouvert du mardi au dimanche de 10h à 12h et de 14h à 18h;
GRAND EST;ARDENNES;;01/02/2003;0810501;Musée Arthur Rimbaud;Quai Arthur Rimbaud;08000;CHARLEVILLE-MEZIERES;0324324464;0324324469;www.mairie-charlevillemezieres.fr/htm/culture/rimbaud.htm;;Ouvert du mardi au dimanche de 10h à 12h et de 14h à 18h;
GRAND EST;ARDENNES;;01/02/2003;0810502;Maison des Ailleurs - Arthur Rimbaud;Quai Rimbaud;08000;CHARLEVILLE-MEZIERES;0324324470;;Site de la ville;;Ouvert du mardi au dimanche de 10h à 12h et de 14h à 18h tous les jours;
GRAND EST;ARDENNES;;01/02/2003;0819001;Musée de Givet;"Mairie
11, Place Carnot";08600;GIVET;0324420684;0324420244;;;;
GRAND EST;ARDENNES;;01/02/2003;0831101;Musée du Feutre;Mairie;08210;MOUZON;0324265076;0324262773;www.culture.gouv.fr/champagne-ardenne/2culture/musee_france/musee_mouzon.html;Octobre à avril;Ouvert tous les jours de mai à septembre de 14h à 18h, en avril et octobre les W.E. et jours fériés de 14h à 18h. Tous les jours sur réservation pour les groupes;
GRAND EST;ARDENNES;;01/02/2003;0836201;Musée du Rethelois et du Porcien;Place Noiret-Chaigneau;08300;RETHEL;0324385216;;;;;
GRAND EST;ARDENNES;;01/02/2003;0840901;Musée du Château-Fort;Cour du château;08208;SEDAN Cedex;0324299880;0324292562;www.chateau-fort-sedan.fr;25 décembre et 1er janvier;Ouvert tous les jours de 10h à 17h et en juillet-août de 10h à 18h;de juin à septembre
GRAND EST;AUBE;;01/02/2003;1003301;Musée Municipal;"Hôtel de ville
Place Carnot - B.P. 110";10202;BAR-SUR-AUBE CEDEX;0325270421;0325272291;;;;
GRAND EST;AUBE;;01/02/2003;1006401;Musée Napoléon Ier;34, Rue de l'Ecole Militaire;10500;BRIENNE-LE-CHATEAU;0325928241;0325271125;www.musee-napoleon-brienne.fr;1er mai, vacances de Noël;Ouvert en 2016 du 4 janvier au 22 mai du mardi au dimanche de 10h à 12h30 et de 14h à 17h;
GRAND EST;AUBE;;01/02/2003;1026101;Musée de la Résistance;Rue Boursault;10250;MUSSY-SUR-SEINE;0325384208;0325384208;Site de l'OT;;Ouvert d'octobre à mars du mardi au vendredi de 9h à 13h et de 14h30 à 17h30, d'avril à mai du lundi au vendredi de 9h à 13h et de 14h à 18h et de juin à septembre du mardi au samedi de 9h à 13h et de 14h à 18h;
GRAND EST;AUBE;;01/02/2003;1026801;Musée Camille Claudel;10, Ri=ue Gustave Flaubert;10400;NOGENT-SUR-SEINE;0325247634;0325399874;http://www.museecamilleclaudel.fr;1er janvier, 1er mai, 1er novembre et 25 décembre;Ouvert du du 1er avril au 31 octobre du mardi au vendredi de 11h à 18h et les samedis et dimanches de 11h à 19h et du 1er novembre au 31 mars du mercredi au samedi de 11h à 18h et les dimanches de 11h à 19h;
GRAND EST;AUBE;;01/02/2003;1038702;Musée Historique de Troyes et de la Champagne;4, Rue Vauluisant;10000;TROYES;0325423333;0325730585;www.musees-troyes.com;1er janvier, 1er mai, 11 novembre et 25 décembre;Ouvert du mercredi au dimanche de 10h à 13h et de 14h à 17h;
GRAND EST;AUBE;;01/02/2003;1038707;Pharmacie Musée de l'Hôtel-Dieu;Quai des Comtes-de-Champagne;10000;TROYES;0325809897;0325801800;www.musees-troyes.com;1er, 1er mai, 1er et 11 novembre et 25 décembre;Ouvert du mardi au dimanche de 10h à 13h et de 14h à 17h;
GRAND EST;AUBE;;01/02/2003;1038706;Musée d'Art Moderne;14, Place Saint-Pierre;10000;TROYES;0325762680;0325769502;www.musees-troyes.com;1er, 1er mai, 1er et 11 novembre et 25 décembre;Ouvert du mardi au dimanche de 10h à 13h et de 14h à 17h;
GRAND EST;AUBE;;01/02/2003;1038704;Musée des Beaux-Arts;1, Rue Chrestien-de-Troyes;10000;TROYES;0325762160;0325801800;www.musees-troyes.com;1er au 9 janvier, 1er mai, 1er et 11 novembre et 25 décembre;Ouvert du mercredi au lundi de 10h à 13h et de 14h à 17h;
GRAND EST;AUBE;;01/02/2003;1038701;Muséum d'Histoire Naturelle;4, Rue Chrestiens de Troyes;10000;TROYES;0325762168;0325801800;www.musees-troyes.com;1er janvier, 1er mai, 11 novembre et 25 décembre;Ouvert du mercredi au vendredi et lundi  de 10h à 13h et de 14h à 19h, le week-en de 11h à 19h de mai à septembre et de 10h à 12h et de 14h à 17 et le week-end de 11h à 18h d'octobre à avril;
GRAND EST;AUBE;;01/02/2003;1038703;Musée de la Bonneterie;"Conservation des Musées 
2, rue Chrestien de Troyes";10000;TROYES;0325730585;0325801800;www.musees-troyes.com;1er janvier, 1er mai, 11 novembre et 25 décembre;Ouvert de mai à septembre le mercredi de 14h à 19h, du jeudi au vendredi de 11h à 13h et de 14h à 19h le week-end de 11h à 13h et de 14h à 19h, d'octobre à avril le mercredi de 14h à 17h et du jeudi au dmanchei de 10h à 12h et de 14h à 17h;
GRAND EST;AUBE;;01/02/2003;1038705;Maison de l'Outil  et de la Pensée Ouvrière;7, Rue de La Trinité;10000;TROYES;0325732826;0325739047;http://mopo3.com;25 décembre,  1ère semaine de janvier, lundi de la Pentecôte;Ouvert d'octobre à mars du mercredi au lundi de 10h à 18h et d'avril à septembre tous les jours de 10h à 18h;
GRAND EST;BAS-RHIN;;01/02/2003;6702101;Musée de la Folie Marco;30, Rue du Dr Sultzer;67140;BARR;0388089472;0388086651;www.musee-foliemarco.com;Novembre à avril;Ouvert de mai à septembre du mercredi au lundi de 10h à 12h et de 14h à 18h, en octobre les samedis et dimanches de 10h à 12h et de 14h à 18h.;
