NOUVELLE-AQUITAINE;VIENNE;;24/01/2006;8614001;Musée de Préhistoire Raymond Touchard;"La Sabline
21, Route de Montmorillon
 BP 23
B.P. 23";86320;LUSSAC-LES-CHATEAUX;0549833980;0549833989;www.lasabline.fr ou www.lussac-les-chateaux.fr;1er janvier, 1er Mai, 8 Mai, 1er et 11 novembre et  25 décembre;Ouvert de janvier à mars, d'octobre à décembre le mercredi et samedi de 10h à 12h et de 14h à 17h, d'avril à juin et septembre mercredi et samedi de 10h à 12h et de 14h à 17h et jeudi, vendredi et dimanche de 14h à 17h, en juillet-août du mardi au dimanch;
NOUVELLE-AQUITAINE;VIENNE;;01/02/2003;8616502;Musée Municipal de la Maison-Dieu;6, Rue des Augustins;86500;MONTMORILLON;0549910232;;www.montmorillon.fr;;;
NOUVELLE-AQUITAINE;VIENNE;;01/02/2003;8619404;Musée du baptistère Saint-Jean;Rue Jean Jaurès;86000;POITIERS;0549412124;0549886584;www.musees-poitiers.org ou www.alienor.org;25 décembre, 1er janvier, 1er mai;Ouvert du 1er avril au 30 septembre de 10h30 à 12h30 et de 15h à 18h du mercredi au lundi en juillet-août tous les jours de 10h30 à 12h30 et de 15h à 18h et du 1er octobre au 31 mars tous les jours de 14h30 à 16h30;
NOUVELLE-AQUITAINE;VIENNE;;01/02/2003;8619406;Collection d'Histoire Naturelle;1, Place de la Cathédrale;86000;POITIERS;0549503300;0549413856;www.maison-des-sciences.org/ - https://emf.fr/;;Ouvert du mardi au vendredi de 9h30 à 18h30, samedi, dimanche, lundi et certains  jours fériés de 14h à 18h30;
NOUVELLE-AQUITAINE;VIENNE;;06/01/2002;8619403;Musée de l'hypogée des Dunes;101 Rue du Père-de-la-Croix;86000;POITIERS;;;www.musees-poitiers.org;;;
NOUVELLE-AQUITAINE;VIENNE;;06/01/2002;8619402;Musée Sainte-Croix;3 bis, Rue Jean Jaurès;86000;POITIERS;0549410753;0549886163;www.musees-poitiers.org ou www.alienor.org;1er janvier, 1er et 8 mai, 1er novembre, 25 décembre;Ouvert du 1er octobre au 31 mai le mardi de 10h à 17h, du mercredi au vendredi de 10h à 12h et de 13h15 à 17h, le week-end de 14h à 18h, du 1er juin au 30 septembre le mardi de 10h à 12h et de 13h15 à 20h, du mercredi au vendredi de 10h à 12h et de 13h15 ;Mardi jusqu'à 20h de juin à septembre
NOUVELLE-AQUITAINE;VIENNE;;06/01/2002;8619401;Musée Rupert de Chièvres;9, Rue Victor Hugo;86000;POITIERS;0549410753;0549886163;www.musees.poitiers.org ou www.alienor.org;;;
OCCITANIE;ARIEGE;;01/02/2003;0912201;Musée Départemental de l'Ariège;Rue du Rocher;09000;FOIX;0534098383;0534098384;www.sesta.fr ou www.ariege.com/chateaufoix/index.html;1er septembre, 25 décembre, 1er janvier;Ouvert de janvier à avril et d'octobre à décembre de 10h30 à 12h et de 14h à 17h30, en janvier la 1ère semaine puis seulement les week-ends, en mai de 10h30 à12h et de 14h à 17h30 en semaine et de 9h45 à 12h et de 14h à 18h les week-ends et jours fériés, ;
OCCITANIE;ARIEGE;;01/02/2003;0916001;Musée du Textile et du Peigne en Corne;65, Rue Jean Jaurès;09300;LAVELANET;0561038919;0534093389;www.paysdolmes.org - www.geocities.com/amtpc2000;1er mai;Ouvert en juillet et août de 14h à 19h et de mi-avril à mi-octobre de 14h à 18h du mardi au dimanche;
OCCITANIE;ARIEGE;;01/02/2003;0918101;Musée de la Préhistoire;Place de l'Eglise;09290;LE MAS D'AZIL;0561699722;0561699926;www.sites-touristiques-ariege.fr;Janvier, 25 décembre;Ouvert en février, mars vacances et dimanches de 14h à 18h, d'avril à juin et septembre du mardi au dimanche de 14h à 18h, juillet/août tous les jours de 11h à 13h et de 14h à 19h, octobre/novembre les dimanches, jours fériés et vacances de 14h à 18h (fer;
OCCITANIE;ARIEGE;;01/02/2003;0920701;Musée de la Forge;Route de Paris;09330;MONTGAILHARD;0534093060;0534093061;www.sesta.fr;25 décembre et 1er janvier;Ouvert lors des vacances d'hiver toutes zones, les vacances de Noël et du 1er dimanche d'avril au 30 juin tous les jours de 10h à 12h et de 13h30 à 18h, le dimanche et jours fériés de 10h à 12h et de 13h30 à 18h30, en juillet-août tous les jours de 10h à ;
OCCITANIE;ARIEGE;;01/02/2003;0921101;Musée d'Archéologie;32, Village;09300;MONTSEGUR;0561010694;0561031127;Site de la ville : www.citaenet.com/montsegur;Janvier et 25 décembre;Ouvert de février à mars de 14h à 17h, en avril de 14h à 18h, de mai à septembre de 11h à 13h et de 14h à 19h, en octobre de 14h à 18h et de novembre à décembre de 14h à 17h;
OCCITANIE;ARIEGE;;01/02/2003;0926801;Musée du Palais des Evêques;Route de Montjoie;09190;SAINT-LIZIER;0561048186;0561051919;www.sites-touristiques-ariege.fr /sites-touristiques-ariege/palais-des-eveques;1er janvier, du 7 janvier au 22 février, du 11 mars au 30 mars, du 4 au 8 novembre et du 12 novembre au 21 décembre, 25 décembre;Ouvert de 14h à 18h du 2 au 5 janvier, du 25 février au 10 mars, du 31 mars au 30 juin, du 17 septembre au 3 novembre et du 22 au 31 décembre et de 10h30 à 19h du 1er juillet au 15 septembre;
OCCITANIE;AUDE;;05/07/2012;1104901;"Musée Municipal ""Eburomagus Musée Archéologique""";2, Avenue du Razès;11150;BRAM;0468789119;0468765687;www.eburomagus.com;De novembre à mars;Ouvert d'avril à juin, septembre à octobre du mercredi au dimanche de 10h à 12h et de 14h à 18h. En juillet-août tous les jours de 10h à 12h et de 14h à 19h. De novembre à mars ouvert sur rendez-vous pour les groupes et scolaires;
OCCITANIE;AUDE;;01/02/2003;1106901;Musée des Beaux-Arts;1, Rue de Verdun;11000;CARCASSONNE;0468777370;0468777389;Site de la ville;1er janvier, 1er et 8 mai, 1er et 11 novembre, 25 décembre;Ouvert du 15 juin au 15 septembre tous les jours de 10h à 18h et du 15 septembre au 15 juin du mardi au samedi de 10h à 12h et de 14 h à 18 h et le premier dimanche du mois de 14h30 à 17h30,;
OCCITANIE;AUDE;;01/02/2003;1107601;Musée Archéologique du Lauragais;"Rampe du Presidial
B.P. 1100";11491;CASTELNAUDARY Cedex;0468600369;0468236188;http://www.ville-castelnaudary.fr;;Ouvert du mercredi au lundi de 14h30 à 18h30 de juin à septembre;
OCCITANIE;AUDE;;01/02/2003;1119401;Musée Municipal;Mairie;11600;LASTOURS;0468775541;0468775541;;;;
OCCITANIE;AUDE;;01/02/2003;1120601;Musée Petiet;"Promenade du Tivoli
B.P. 88";11304;LIMOUX Cedex;0468318503;0468318711;www.limoux.fr/fr/tourisme/musee_petiet.html;Jours fériés;Ouvert hors saison du mardi au vendredi de 14h à 18h30, premier samedi du mois de 9h à 12h et en saison du mercredi au dimanche de 9h30 à 12h30 et de 15 à 19h;
OCCITANIE;AUDE;;12/06/2002;1126202;Musée Archéologique;Place de l'Hôtel de ville;11100;NARBONNE;0468903054;0468903059;www.mairie-narbonne.fr;1er janvier, 1er mai, 1er et 11 novembre, 25 décembre;Ouvert du 1er novembre au 31 mars du mercredi au lundi de 14h à 17h, du 1er avril au 14 juillet du mercredi au lundi de 10h à 12h et de 14h à 17h, et du 15 juillet au 31 octobre tous les jours de 10h à 13h et de 14h30 à 18h;
OCCITANIE;AUDE;;12/06/2002;1126201;Musée d'Art et d'Histoire;"Ancien Palais des Evêque
Place de l'Hôtel de ville";11100;NARBONNE;0468903054;0468903059;www.mairie-narbonne.ff;1er janvier, 1er mai, 1er et 11 novembre, 25 décembre;Ouvert du 1er octobre au 31 mai du mercredi au lundi de 10h à 12 et de 14h à 17h, et du 1er juin au 30 septembre tous les jours de 10h à 18h;
OCCITANIE;AUDE;;01/02/2003;1136901;Musée Archéologique;Allée des Potiers;11590;SALLELES D'AUDE;0468468948;0468468811;www.amphoralis.com;1er mai, 1er et 11 novembre et du 19 décembre au 6 janvier;Ouvert d'octobre à mai du mardi au vendredi de 13h30 à 17h, samedi-dimanche de 10h à 12h et de 14h à 18 et de juin à septembre du mardi au dimanche de 10h à 12h et de 15h à 19h;
OCCITANIE;AUDE;;01/02/2003;1137901;Musée des Corbières;Place de la Libération;11130;SIGEAN;0468415989;0468488789;www.sigean.fr  ou www.audealaculture.fr;;Ouvert de novembre à mars de 9h à 12h le mercredi et de 14h à 15h45 lundi, mardi jeudi et vendredi, en septembre, octobre, avril à juin de 14h à 15h45 le lundi, mardi, jeudi et vendredi, en juillet-août de 15h à 18h le lundi, mardi, jeudi et vendredi. Vis;
OCCITANIE;AVEYRON;;01/02/2003;1208901;Musée Régional de Géologie Pierre Vetter;Avenue Paul Ramadier;12300;DECAZEVILLE;0565433008;0565433008;www.decazeville.fr ou www.musees-midi-pyrenees.fr;;Ouvert du mardi au samedi de 10h à 12h et de 14h à 18h;
OCCITANIE;AVEYRON;;01/02/2003;1209602;Musée Joseph Vaylet;"Ancienne église St. Jean Baptiste
35, rue Droite";12500;ESPALION;0565441063;0565441039;www.museeduscaphandre.com - musees.aveyron.fr;Les autres mois;Ouvert de juin à septembre du mardi au dimanche de 10h à 12h30 et de 14h à 18h, en avril, mai, octobre le mardi, jeudi, samedi de 14h30 à 16h30;
OCCITANIE;AVEYRON;;01/02/2003;1209601;Musée des Mœurs et Coutumes, Musée du Rouergue;Place Pierre Frontin;12500;ESPALION;0565441991;0565736470;www.musees.aveyron.fr;Octobre à mai;Ouvert de juin à septembre du mardi au jeudi de 10h à 12h et de 14h à 18h, du vendredi au dimanche de 14h à 18h;
OCCITANIE;AVEYRON;;01/02/2003;1214501;Musée Municipal de Millau;"Hôtel de Pégayolles
Place du Maréchal Foch";12100;MILLAU;0565590108;0565612691;www.millauculture.fr ou www.ot-millau.fr;Jours fériés d'octobre à mai;Ouvert de septembre à juin du lundi au samedi de 10h à 12h et de 14h à 18h, en juillet-août tous les jours de 10h à 12h30 et de 14h30 19h;
OCCITANIE;AVEYRON;;24/01/2006;1220204;Musée Soulages;"Jardin du Foirail
Avenue Victor Hugo";12000;RODEZ;0565738244;;http://musee-soulages.rodezagglo.fr/;1er janvier, 1er mai, 1er novembre et 25 décembre;Ouvert d'avril à juin du mardi au dimanche de 11h à 19h, en juillet-août le lundi de 14h à 19h et du mardi au dimanche inclus de 10h à 19h, en septembre du mardi au dimanche inclus de 11h à 19h, d'octobre à avril du mardi au vendredi de 10h à 12h et de 14;
OCCITANIE;AVEYRON;;01/02/2003;1220201;Musée Fenaille;14, Place Eugène Raynaldy;12000;RODEZ;0565738430;0565738431;http://musee-fenaille.rodezagglo.fr/;1er janvier, 1er mai, 1er novembre, 25 décembre;Ouvert du 11 avril au 30 juin et du 1er au 30 septembre du mardi au samedi de 11h à 19h, le dimanche de 14h à 19h, en juillet-août le lundi de 14h à 19h et du mardi au dimanche de 10h à 19h, du 1er octobre au 31 mars du mardi au vendredi de 10h à 12h et d;
OCCITANIE;AVEYRON;;01/02/2003;1220202;Musée des Beaux-Arts Denys Puech;Place Georges Clemenceau;12000;RODEZ;0565778960;0565778803;http://musee-denys-puech.grand-rodez.com/;1er janvier, 1er mai, 1er novembre et 25 décembre;Ouvert du mardi au vendredi de 10 h à 12 h et de 14 h à 18 h, samedi et dimanche de 14h à 18h;
OCCITANIE;AVEYRON;;01/02/2003;1220301;Musée Municipal d'archéologie;Rue Saint-Pierre;12250;ROQUEFORT-SUR-SOULZON;0565599195;0565599516;;;;
OCCITANIE;AVEYRON;;01/02/2003;1225401;Musée des Arts et Métiers Traditionnels;;12330;SALLES-LA-SOURCE;0565672896;0565672896;www.musees-aveyron.fr;De novembre à mars;"Ouvert en avril et octobre les  mercredi , jeudi et dimanche de 14h à 18h, mai/juin/septembre du mercredi au lundi de 14h à 18h, juillet-août du mardi au vendredi de 10h à 12h30 et de 13h30 à 18h30, les samedi, dimanche et lundi de 13h30 à 18h30
Visites ";
OCCITANIE;AVEYRON;;01/02/2003;1225501;Musée du Charroi Rural et de l'Artisanat Traditionnel;Ancienne Eglise Saint-Firmin;12120;SALMIECH;0565742355;0565742679;www.musee-charroi-rural-salmiech.fr;;Ouvert en Juillet et Août tous les jours de 11h à 12h et de 14h30 à 18h30. Autres jours de l'année, sur rendez-vous;
OCCITANIE;AVEYRON;;01/02/2003;1230001;Musée Municipal Urbain Cabrol;Place de la Fontaine;12200;VILLEFRANCHE-DE-ROUERGUE;0565454437;0565450170;www.villefranchederouergue.fr;Jours fériés;Ouvert d'avril à juin du mardi au samedi de 14h à 19h, de juillet à septembre du mardi au samedi de 10h à 12h et de 14h à 19h;
OCCITANIE;GARD;;01/02/2003;3000701;Musée-Bibliothèque Pierre-André Benoît;"Rue de Brouzen
Pôle culturel de Rochebelle";30100;ALES;0466869869;0466342051;site de la ville - www.ville-ales.fr;1ère quinzaine de février, 1er novembre, 25 décembre, 1er janvier, 1er mai, 14 juillet, jeudi de l'Ascension;Ouvert du lundi au dimanche de septembre à juin de 14h à 18h et de 11h à 18h lors des expositions estivales;
OCCITANIE;GARD;;01/02/2003;3000702;Musée du Colombier;Rue Jean Mayodon;30100;ALES;0466863040;0466342051;site de la ville - www.ville-ales.fr;2ème quinzaine de février, 1er janvier, 1er mai, jeudi de l'Ascension, 14 juillet, 1er novembre, 25 décembre;Ouvert du lundi au dimanche de septembre à juin de 14h à 18h et en continu durant les expositions estivales;
OCCITANIE;GARD;;01/02/2003;3002801;Musée Albert André;"Hôtel de ville
Place Auguste-Mallet";30200;BAGNOLS-SUR-CEZE;0466505056;0466905939;Site dela ville ou Site du conseil général;Février;Ouvert du mardi au dimanche de 10h à 12h et de 14h à 18h;
OCCITANIE;GARD;;01/02/2003;3002802;Musée Léon Alègre;24, avenue Paul Langevin;30200;BAGNOLS-SUR-CEZE;0466897400;0466905939;Site de la ville ou site du conseil général;Février;Ouvert mardi, jeudi et vendredi de 10h à 12h et de 14h à 18h;
OCCITANIE;GARD;;01/02/2003;3003201;Musée Municipal de la Vignasse;"Mairie
Rue de l'Hôtel de ville";30300;BEAUCAIRE;0466599007;0466594761;www.beaucaire.fr/spip.php?article65;Du 25 décembre au 2 janvier inclus, 1er & 8 mai, 1er & 11 novembre;Ouvert du 1er avril au 30 juin du mercredi au vendredi de 9h30 à 12h30 et de 14h à 18h et le samedi de 14h à 18h, du 1er juillet au 30 septembre du mercredi au dimanche de 9h30 à 12h30 et de 14h à 18h et du 1eroctobre au 31 mars de 14h à 17h;
OCCITANIE;GARD;;01/02/2003;3035001;Musée Cévenol;1, Rue des Calquières;30120;LE VIGAN;0467810686;0467819937;www.musee-cevenol-levigan.fr ou http://museecevenol-levigan.jimdo.com/;De janvier à mars, en  novembre et décembre, 1er janvier, 1er mai, 1er et 11 novembre, 25 décembre;Ouvert d'Avril à juin et en septembre, octobre du mercredi au dimanche de 10h à 12h et de 14h à 18h,  exceptionnellement le lundi de Pâques et lundi de Pentecôte, en  juillet et août, du mercredi au lundi de 10h à 13h et de 15h à 18h30;
OCCITANIE;GARD;;01/02/2003;3018904;Musée du Vieux Nîmes;Place aux Herbes;30000;NIMES;0466767370;0466767371;www.nimes.fr/index.php?id=283;1er janvier, 1er mai, 1er novembre et 25 décembre;Ouvert du mardi au dimanche de 10h à 18h;Jeudis en juillet-août
OCCITANIE;GARD;;01/02/2003;3018907;Musée des Cultures Taurines;6, Rue Alexandre Ducros;30000;NIMES;0466368377;0466210958;http://www.nimes.fr/index.php?id=282;1er janvier, 1er mai, 1er novembre et 25 décembre. De la Toussaint à l'Ascension;Ouvert du mardi au dimanche de 10h à 18h de juin à novembre;Jeudis en juillet-août
OCCITANIE;GARD;;01/02/2003;3018903;Musée Archéologique;13, Boulevard Amiral Courbet;30000;NIMES;0466767480;0466767494;www.nimes.fr/index.php?id=280;1er janvier, 1er mai, 1er novembre et 25 décembre;Ouvert du mardi au dimanche de 10h à 18h;
OCCITANIE;GARD;;01/02/2003;3018906;Carré d'Art Musée d'Art Contemporain de Nîmes;Place de la Maison Carrée;30031;NIMES Cedex 1;0466763570;0466763585;www.carreartmusee.com;1er mai, 1er novembre, 25 décembre et 1er janvier;Ouvert du mardi au dimanche de 10h à 18h;jeudi soir en juillet-aôut
OCCITANIE;GARD;;01/02/2003;3018905;Musée des Beaux-Arts;Rue Cité Foulc;30033;NIMES Cedex 9;0466767191;0466767192;www.nimes.fr;1er janvier, 1er mai, 1er novembre, 25 décembre;Ouvert du mardi au dimanche de 10h à 18h et le second jeudi de chaque mois de 10h à 21h (jeudi des copistes) et tous les jeudis en juillet-août;Second jeudi de chaque mois jusqu'à 21h, et tous les jeudis en juillet août
OCCITANIE;GARD;;06/01/2002;3018901;Musée d'Histoire Naturelle et de Préhistoire;13 Bis, Bd Amiral Courbet;30033;NIMES Cedex 9;0466767345;0466767346;site de la ville - www.nimes.fr;1er janvier, 1er mai, 1 & 11 novembre, 25 décembre;Ouvert du mardi au dimanche de 10h à 18h;
OCCITANIE;GARD;;01/02/2003;3020202;Musée Départemental d'Art Sacré du Gard;"Maison des Chevaliers
2, Rue Saint-Jacques";30130;PONT-SAINT-ESPRIT;0466391761;0466905939;http://www.gard-provencal.com/musees/artsacre.htm;Jours fériés, février;Ouvert du mardi au dimanche de 10h à 12h et de 14h à 18h de septembre à juin et en juillet-août de 10h à 12h30 et de 15h à 18h30;
OCCITANIE;GARD;15/05/2014;01/02/2003;3020201;Musée Paul Raymond;Place de l'Ancienne Mairie;30130;PONT-SAINT-ESPRIT;0466390998;0466905939;;;;
OCCITANIE;GARD;;01/02/2003;3025801;Musée de la Maison Romane;"Place de la Maison Romane
B.P. 77";30800;SAINT-GILLES-DU-GARD;0466874042;0466877819;http://saint-gilles.fr/musee-de-la-maison-romane;Janvier, jours fériés, le 24 et 31 décembre;Ouvert d'avril à octobre du mercredi au vendredi de 10h30 à 12h30 et de 14h à 16h, de novembre à mars du mercredi au vendredi de 14h à 16h;
OCCITANIE;GARD;;01/02/2003;3026901;Musée des Vallées Cévenoles;;30270;SAINT-JEAN DU GARD;0466851048;0466851361;www.museedescevennes.com;;"Musée fermé en 2014 - réouverture prévue au printemps 2016

Ouvert d'avril à juin et de septembre à octobre tous les jours de 10h à 12h30 et de 14h à 19h, de juillet à août tous les jours de 10h à 19h, de novembre à mars le mardis et le jeudis de 9h à 1";
OCCITANIE;GARD;;01/02/2003;3033401;Musée Municipal Georges Borias;"Ancien Evêché
BP 103";30701;UZES Cedex;0466224023;;http://uzesmusee.blogspot.com ou http://www.uzes-tourisme.com/sitefr/musees/borias.htm;Janvier, 1er novembre, 25 décembre;Ouvert du mardi au dimanche en févrieret novembre-décembre de 14h à 17h, de mars à juin et septembre à octobre de 15h à 18h, juillet-août de 10h à 12h et de 15h à 18h;
OCCITANIE;GARD;;01/02/2003;3035101;Musée Pierre de Luxembourg;3, Rue de la République;30400;VILLENEUVE-LES-AVIGNON;0490274966;0466905939;Site du conseil général;Février;Ouvert de novembre à mai du mardi, jeudi et vendredi, samedi et dimanche de 14h à 17h, le mercredi de 10h à 12h et de 14H à 17h et de mai à octobre du mardi au dimanche de 10h à 12h30 et de 14h à 18H;
OCCITANIE;GERS;;01/02/2003;3201301;Musée des Jacobins;4, Place Louis Blanc;32000;AUCH;0562057479;0562619095;www.musee-jacobins.auch.fr www.auch-tourisme.com ou site de la mairie;Janvier et jours fériés;Ouvert du 1er février au 31 mars et du 1er novembre au 31 décembre du lundi au vendredi de 14h à 17h, le samedi samedi et dimanche de 10h à 12h et de 14h à 17h, du 1er avril au 31 octobre tous les jours de 10h à 12h et de 14h à 18h;
OCCITANIE;GERS;;01/02/2003;3210701;Musée de l'Armagnac;2, Rue Jules Ferry;32100;CONDOM;0562284717;0562284705;site du département : www.gers-gascogne.com;Janvier;Ouvert de novembre à mars du mercredi au dimanche de 14h à 17h et d'avril à octobre du mercredi au lundi de 10h à 12h et de 15h à 18h;
OCCITANIE;GERS;;01/02/2003;3211901;Musée Archéologique;Place de la République;32180;EAUZE;0562097138;0562097920;site du département : www.gers-gascogne.com ou site de la mairie;Janvier,  1er week-end de juillet;Ouvert du 1er mars au 30 juin et du 1er septembre au 30 novembre tous les jours de 10h à 12h et de 14h à 18h, du 1er juillet au 31 août tous les jours de 10h à 19h. En décembre et février sur réservation pour les groupes;
OCCITANIE;GERS;;01/02/2003;3220801;Musée d'Archéologie;"Place du Général de Gaulle
Hôtel de Ville";32700;LECTOURE;0562687022;0562689160;site du département : www.gers-gascogne.com;Jours fériés;"Ouvert du 1er mars au 30 septembre de 10h à 12h et de 14h à 18h.
Du 1er octobre au 28 février de 10h à 12h et de 14h à 18h";
OCCITANIE;GERS;;01/02/2003;3216001;Musée Campanaire;Place de l'Hôtel de ville;32600;L'ISLE JOURDAIN;0562073001;0562071222;site du département : www.gers-gascogne.com;1er janvier au 15 janvier, 1er mai, 25 décembre;Ouvert du mardi au samedi de 10h à 12h et de 14h à 18h, le premier dimanche du mois;
OCCITANIE;GERS;;01/02/2003;3223301;Musée Joseph Abeilhé;"Mairie de Marciac
19, Place de l'Hôtel de Ville";32230;MARCIAC;0562093803;0562082310;Site de la région : www.musees-midi-pyrenees.fr;;Ouvert du lundi au vendredi de 8h30 à 12h et de 13h30 à 17h;
OCCITANIE;GERS;;01/02/2003;3225601;Musée des Beaux-Arts et des Arts Décoratifs;13, rue de l'Evêché;32300;MIRANDE;0562666810;0562668709;site du département : www.gers-gascogne.com;Jours fériés;Ouvert du lundi au vendredi de 9h à 12h et de 14h à 18h, le samedi de 10h à 12h et de 15h à 18h, et le dimanche de 10h à 12h en juillet août;
OCCITANIE;HAUTE-GARONNE;;01/02/2003;3102801;Musée-Forum de l'Aurignacien;Avenue de Benabarre;31420;AURIGNAC;0561909072;0561987133;www.musee-aurignacien.com;Janvier, 1er mai, 1er novembre, 25 décembre;Ouvert de septembre à juin du mercredi au dimanche de 14h à 18h, et en juillet-août et vacances zone C du mardi au dimanche de 10h à 18h;
OCCITANIE;HAUTE-GARONNE;;01/02/2003;3104201;Musée du Pays de Luchon;18, Allée d'Etigny;31110;BAGNERES-DE-LUCHON;0561792987;0561791123;www.luchon.com ou www.mairies-luchon.fr -www.musees-midi-pyrenees.fr;Jours fériés - Novembre;Ouvert du mercredi au lundi de 10h à 12h et de 15h à 18h;
OCCITANIE;HAUTE-GARONNE;;01/02/2003;3132401;Musée Municipal;Place Henri Dulion;31220;MARTRES-TOLOSANE;0561986641;0561985929;www.tourisme-martres-tolosane.fr;Première semaine de janvier;Ouvert en décembre, janvier, février du mardi au vendredi de 9h30 à 12h30 et de 13h30 à 17h30, de mi-juin à mi-septembre tous les jours de 9h30 à 12h30 et de 13h30 à 18h30, le reste de l'année du mardi au samedi de 9h30 à 12h30 et de 13h30 à 17h30;
OCCITANIE;HAUTE-GARONNE;;01/02/2003;3147201;Musée Archéologique Départemental;Bâtiment de l'Ancienne Gendarmerie;31510;SAINT-BERTRAND-DE-COMMINGES;0561883179;0561888381;http://www.musees-midi-pyrenees.fr/musees/musee-archeologique-departemental;Janvier;Expositions temporaires tous les jours de 10h à 17h de mai à septembre;
OCCITANIE;HAUTE-GARONNE;;01/02/2003;3156501;Musée Municipal d'Art et d'Histoire;6, place de Mas Saint Pierre;31800;SAINT-GAUDENS;0561890542;0561947866;www.mairiestgaudens.fr;;Lors des xxposition hors les murs du mardi au samedi de 10h à 12h et de 14h à 18h en 2016;Chaque vendredi à 20h30 en juillet-août
OCCITANIE;HAUTE-GARONNE;;01/02/2003;3155507;Musée des Transports et des Communications;93, avenue Jules Julien;31400;TOULOUSE;0561550210;0561550210;http://asptuit.free.fr;;Ouvert les jeudis de 10h à 12h et de 14h à 16h et sur rendez-vous;
OCCITANIE;HAUTE-GARONNE;;01/02/2003;3155506;Musée du Vieux Toulouse;"Hôtel Dumay
7, Rue du May";31000;TOULOUSE;0562271150;0562275088;htt://toulousainsdetoulouse.fr;Jours fériés;Ouvert de mi-avril à mi-novembre du lundi au samedi de 14h à 18h. Ouvert toute l'année sur rendez-vous pour les groupes.;
OCCITANIE;HAUTE-GARONNE;;01/02/2003;3155505;Musée Georges Labit;17, rue du Japon;31400;TOULOUSE;0561534825;0561146559;;Jours fériés;Ouvert du mardi au dimanche de 10h à 17h d'octobre à mai et de 10h à 18h de juin à septembre;
OCCITANIE;HAUTE-GARONNE;;06/01/2002;3155504;Musée des Augustins;21, rue de Metz;31000;TOULOUSE;0561222182;0561223469;www.augustins.org;;Ouvert tous les jours de 10h à 18h. Nocturne le mercredi jusqu'à 21h;Mercredi jusqu'à 21h
OCCITANIE;HAUTE-GARONNE;;01/02/2003;3155503;Musée Paul Dupuy;13, Rue de la Pléau;31000;TOULOUSE;0531229540;0561146559;Site des musées de la région : www.musees-midi-pyrenees.fr/;Jours fériés;Ouvert du mardi au dimanche de 10h à 17h d'octobre à mai et de 10h à 18h de juin à septembre;
OCCITANIE;HAUTE-GARONNE;;01/02/2003;3155502;Musée Saint-Raymond;1, Place Saint Sernin;31000;TOULOUSE;0561223144;0561223125;www.SaintRaymond.toulouse.fr;1er janvier, 1 mai et 25 décembre;Ouvert tous les jours de 10h à 18h, de 10h à 19h du 1er juillet au 31 août. Fermeture exceptionnelle à 17h les 24 et 31 décembre;
OCCITANIE;HAUTE-GARONNE;;01/02/2003;3155501;Les Abattoirs, Musée d'Art Moderne et Contemporain;76, allées Charles-de-Fitte;31300;TOULOUSE;0562485800;0562485801;www.lesabattoirs.org;1er janvier, 1er mai et 25 décembre;Ouvert du mercredi au dimanche de 12h à 18h , nocturne le jeudi jusqu'à 20h;Jeudi jusqu'à 20h (hors vacances scolaires et en juin)
OCCITANIE;HAUTE-GARONNE;;06/01/2002;3155509;Muséum d'Histoire Naturelle;35, allées Jules Guesde;31000;TOULOUSE;0567738484;0567738448;www.museum.toulouse.fr;1er janvier, 1er mai, 25 décembre;Ouvert de 10h à 18h du mardi au dimanche;
OCCITANIE;HAUTES-PYRENEES;;01/02/2003;6505905;Muséum d'Histoire Naturelle;7, Place des Thermes de Salut;65200;BAGNERES-DE-BIGORRE;0562911205;;www.museesbagneres.fr/;;Ouvert de mai à octobre du mercredi au dimanche de 15h à 18h, de novembre à avril le mercredi et dimanche de 15h à 18h;
OCCITANIE;HAUTES-PYRENEES;;01/02/2003;6505902;Musée Salies;Place des Thermes;65200;BAGNERES-DE-BIGORRE;0562910726;0562910293;www.museesbagneres.fr/;;Ouvert du mercredi au dimanche de 10h à 12h et de 14h à 18h, samedi et dimanche de 15h à 18h;
OCCITANIE;HAUTES-PYRENEES;;01/02/2003;6505901;Musée de la Vie Quotidienne dans les Pyrénées;Rue Hount-Blanque;65200;BAGNERES-DE-BIGORRE;0562910733;;www.museesbagneres.fr/;;;
OCCITANIE;HAUTES-PYRENEES;;01/02/2003;6528601;Musée Pyrénéen;Château fort;65100;LOURDES;0562423737;0562423744;www.chateaufort-lourdes.fr ou site de la ville - http://www.lourdes-visite.com/;1er janvier, 1er & 11 novembre, 25 décembre;Ouvert de janvier à mi-avril de 10h à 18h, le lundi de 10h à 17h, de mi-avril à mi-octobre de 10h à 19h  et de mi-octobre à fin décembre de 10h à 18h et le lundi de 10h à 17h;
OCCITANIE;HAUTES-PYRENEES;;01/02/2003;6529501;Musée Municipal - Musée Trésor;Presbytère;65120;LUZ-SAINT-SAUVEUR;0562923588;;;;Ouvert tous les jours de juin à septembre de 16h à 18h30;
OCCITANIE;HAUTES-PYRENEES;;01/02/2003;6530601;Musée-château Gaston Phébus;Château-Fort de Mauvezin;65130;MAUVEZIN;0562391027;0562391027;www.chateaudemauvezin.com;;Ouvert tous les jours du 15 octobre au 14 avril de 13h30 à 17h30 et du 15 avril au 14 octobre de 10h à 19h;
